{
  "$id": "template",
  "$schema": "http://json-schema.org/draft-07/schema#",
  "title": "template",
  "type": "object",
  "properties": {
    "execute_on": {
      "anyOf": [
        { "const": "ve" },
        { "const": "lxc" },
        { "type": "string", "pattern": "^host:.*$" }
      ]
    },
    "if": {
      "type": "boolean"
    },
    "name": {
      "type": "string",
      "maxLength": 30
    },
    "description": {
      "type": "string"
    },
    "parameters": {
      "type": "array",
      "items": {
        "type": "object",
        "properties": {
          "name": { "type": "string" },
          "id": { "type": "string" },
          "if": { "type": "string" },
          "type": { "enum": ["string", "number", "enum", "boolean"] },
          "description": { "type": "string" },
          "required": { "type": "boolean", "default": false },
          "secure": { "type": "boolean", "default": false },
          "default": { "type": ["string", "number", "boolean"] }
        },
        "required": ["name", "id", "type"],
        "if": { "properties": { "type": { "const": "enum" } } },
        "then": {
          "properties": {
            "enumValues": {
              "type": "array",
              "items": { "type": "string" }
            },
            "enumValuesTemplate": {
              "type": "string"
            }
          },
          "anyOf": [
            { "required": ["enumValues"] },
            { "required": ["enumValuesTemplate"] }
          ]
        }
      }
    },
    "outputs": {
      "type": "array",
      "items": { "$ref": "output.template#" }
    },
    "commands": {
      "type": "array",
      "minItems": 1,
      "items": { "$ref": "#/$defs/command" }
    }
  },
  "if": {
    "properties": { "type": { "enum": ["command", "script", "template"] } }
  },
  "then": { "properties": { "enumValues": { "type": "string" } } },
  "required": ["commands", "execute_on", "name"],
  "additionalProperties": false,
  "$defs": {
    "command": {
      "type": "object",
      "properties": {
        "name": { "type": "string", "maxLength": 30 },
        "description": { "type": "string" },
        "if": { "type": "string" },
        "command": { "type": "string" },
        "script": { "type": "string" },
        "schema": { "type": "string" },
        "template": { "type": "string" }
      },
      "oneOf": [
        { "required": ["command"] },
        { "required": ["script"] },
        { "required": ["schema"] },
        { "required": ["template"] }
      ],
      "errorMessage": {
        "oneOf": "Exactly one of 'command', 'script' or 'schema' must be present."
      },
      "additionalProperties": false
    }
  }
}
