{
  "execute_on": "ve",
  "name": "Latest OS Template",
  "description": "Download latest operating system template for Proxmox",
  "parameters": [
    {
      "id": "ostype",
      "name": "Operating System Type",
      "type": "enum",
      "default": "alpine",
      "description": "One of alpine, debian, ubuntu. Base template to download",
      "enumValues": ["alpine", "debian", "ubuntu"]
    }
  ],
  "outputs": ["template_path"],
  "commands": [
    {
      "name": "Latest OS Template",
      "script": "get-latest-os-template.sh"
    }
  ]
}
