{
	"execute_on": "proxmox",
	"name": "set-ip-prefixes",
	"description": "Set sensible local IPv4/IPv6 prefixes and enable static IP mode.",
	"parameters": [],
	"outputs": [
		{ "id": "use_static_ip", "default": true }
	],
	"commands": [
		{
			"name": "emit-prefix-params",
			"command": "sh -lc 'echo { \"id\": \"use_static_ip\", \"value\": true }; echo { \"id\": \"ip4_prefix\", \"value\": \"192.168.4\" }; echo { \"id\": \"ip4_cidr\", \"value\": \"24\" }; echo { \"id\": \"ip6_prefix\", \"value\": \"fd00:4::\" }; echo { \"id\": \"ip6_cidr\", \"value\": \"64\" }; echo { \"id\": \"static_gw\", \"value\": \"192.168.4.1\" }; echo { \"id\": \"static_gw6\", \"value\": \"fd00:4::1\" }'"
		}
	]
}

