{
  "execute_on": "ve",
  "name": "310-create-user",
  "description": "Create a user inside the LXC container with specified username, uid, gid, and optional mountpoint write check. Calls create-user.sh with template variables.",
  "commands": [
    {
      "script": "create-user.sh",
      "description": "Create a user inside the LXC container with specified username, uid, gid, and optional mountpoint write check. Calls create-user.sh with template variables."
    }
  ],
  "parameters": [
    {
      "id": "username",
      "name": "Username",
      "type": "string",
      "description": "The username to create inside the LXC container.",
      "required": true
    },
    {
      "id": "uid",
      "name": "UID",
      "type": "string",
      "description": "The UID for the user",
      "required": true
    },
    {
      "id": "gid",
      "name": "GID",
      "type": "string",
      "description": "The GID for the user",
      "required": true
    },
    {
      "id": "mountpoint",
      "name": "Mountpoint",
      "type": "string",
      "description": "Optional: The mountpoint to check for write access. Can be empty if not needed."
    }
  ]
}
